{
  "scenario": "swing",
  "window": "1d",
  "mode": "v2.fractal",
  "features_micro": {
    "price_change_pct": 1.5,
    "volume_change_pct": 80.0,
    "funding_rate_bps": 8.0,
    "oi_change_pct": 25.0
  },
  "features_mezo": {
    "net_positioning_index": -0.2,
    "liquidation_heatmap_entropy": 0.3
  },
  "features_macro": {
    "active_addrs_trend": 0.05,
    "macro_regime_score": 0.4
  },
  "vol_regime_pctl": 0.15,
  "nagr_nodes": [
    {
      "id": "deriv_bias",
      "weight": 0.5,
      "score": -0.1
    },
    {
      "id": "macro_trend",
      "weight": 0.5,
      "score": 0.2
    }
  ]
}